{
  "contract_version": 1,
  "created_at": "2026-10-15T22:23:36.711043Z",
  "dataset": {
    "n_cases": 60,
    "n_negative_cases": 10,
    "name": "cierzo-full",
    "sha256": "sha256:cc8ecbc676f7a20790836fe40568a6da2b0c90fbb66d60569bc6518ff7d1dce4",
    "version": 1
  },
  "environment": {
    "deterministic": true,
    "hardware": "MacBook Pro M4 Max, 36 GB unificada, macOS 26.5",
    "models": {
      "generador": "gemma4:26b-mlx (ollama:c8656f50f0a6)"
    },
    "python": "3.12.4",
    "seed": 20260903
  },
  "metrics": [
    {
      "ci95": [
        0.3931,
        0.6383
      ],
      "id": "G-EXEC-ACC",
      "n": 60,
      "per_stratum": {
        "join_o_agregacion": 0.48,
        "simple": 0.7,
        "ventana_o_correlada": 0.3333
      },
      "raw_path": "evals/reports/exec-accuracy.json",
      "unit": "ratio",
      "value": 0.5167
    }
  ],
  "notes": "provenance del banco: agente_transcrito_del_glosario_firmado. Mientras no diga `revisado_humano`, el banco se escribió con asistencia de IA transcribiendo el glosario firmado y no tiene revisión humana externa: el número es autoevaluado contra su propia respuesta correcta.",
  "project": "datawarden",
  "prompts": [
    {
      "id": "nl2sql",
      "role": "generator",
      "sha256": "sha256:461802bd6e8134b8bc31e3df973062dfe437bf7ee4655358cbc7a6e4c1543ed0",
      "version": 2
    }
  ],
  "run_id": "exec-20261015T222336Z",
  "suite": "exec-accuracy"
}
